[
  {
    "card_id": "paradiznik_setev_1",
    "plant_id": "paradiznik",
    "months": "marec;april",
    "task_type": "setev",
    "section": "this_week",
    "title": "Preveri setev za paradižnik",
    "short_reason": "Toploljubne plodovke se običajno začnejo v zaščitenem prostoru, ne neposredno na mrzlo gredo.",
    "details": "Uporabi mesečni koledar in sortna navodila; sadike naj imajo dovolj svetlobe.",
    "time_needed": "15–25 min",
    "priority": 6,
    "confidence": "medium",
    "weather_rule_ids": "cold_night;frost_risk",
    "garden_types": "vrt;visoka_greda;balkon",
    "source_ids": "kgzs_plodovke_lonce;ivr_paradiznikova_plesen;kgzs_dobri_sosedje"
  },
  {
    "card_id": "paradiznik_sajenje_2",
    "plant_id": "paradiznik",
    "months": "maj",
    "task_type": "sajenje",
    "section": "today",
    "title": "Paradižnik: presajaj šele po varnem toplem obdobju",
    "short_reason": "Plodovke so občutljive na nizke temperature in mrzla tla.",
    "details": "Če so noči hladne, počakaj ali uporabi zaščito. Na balkonih sadike čez noč po potrebi umakni v zavetje.",
    "time_needed": "20–40 min",
    "priority": 8,
    "confidence": "medium",
    "weather_rule_ids": "cold_night;frost_risk;windy_day",
    "garden_types": "vrt;visoka_greda;balkon",
    "source_ids": "kgzs_plodovke_lonce;ivr_paradiznikova_plesen;kgzs_dobri_sosedje"
  },
  {
    "card_id": "paradiznik_zalivanje_3",
    "plant_id": "paradiznik",
    "months": "junij;julij;avgust",
    "task_type": "zalivanje",
    "section": "today",
    "title": "Zalij paradižnik ob korenini",
    "short_reason": "Plodovke v vročini hitro trpijo zaradi neenakomerne vlage.",
    "details": "Zalivaj zjutraj ali zvečer. Izogibaj se močenju listov, posebej pri paradižniku in papriki.",
    "time_needed": "10–20 min",
    "priority": 8,
    "confidence": "medium_high",
    "weather_rule_ids": "dry_three_days;hot_day;very_hot_day",
    "garden_types": "vrt;visoka_greda;balkon",
    "source_ids": "kgzs_plodovke_lonce;ivr_paradiznikova_plesen;kgzs_dobri_sosedje"
  },
  {
    "card_id": "paradiznik_pregled_4",
    "plant_id": "paradiznik",
    "months": "junij;julij;avgust",
    "task_type": "pregled",
    "section": "watch",
    "title": "Preglej liste in zračnost pri paradižnik",
    "short_reason": "Toplo, vlažno ali mokro vreme poveča tveganje za bolezni pri občutljivih rastlinah.",
    "details": "Odstrani poškodovane liste, izboljšaj zračnost in ne delaj po mokrih rastlinah.",
    "time_needed": "5–10 min",
    "priority": 7,
    "confidence": "medium_high",
    "weather_rule_ids": "humid_warm_day;rain_today",
    "garden_types": "vrt;visoka_greda;rastlinjak",
    "source_ids": "kgzs_plodovke_lonce;ivr_paradiznikova_plesen;kgzs_dobri_sosedje"
  },
  {
    "card_id": "paradiznik_obiranje_5",
    "plant_id": "paradiznik",
    "months": "julij;avgust;september",
    "task_type": "obiranje",
    "section": "today",
    "title": "Obiraj zrele plodove: paradižnik",
    "short_reason": "Redno obiranje spodbuja nadaljnjo rast in zmanjšuje preobremenitev rastline.",
    "details": "Obiraj nežno; prezrele ali poškodovane plodove odstrani.",
    "time_needed": "5–15 min",
    "priority": 6,
    "confidence": "medium",
    "weather_rule_ids": "",
    "garden_types": "vrt;visoka_greda;balkon",
    "source_ids": "kgzs_plodovke_lonce;ivr_paradiznikova_plesen;kgzs_dobri_sosedje"
  },
  {
    "card_id": "paprika_setev_6",
    "plant_id": "paprika",
    "months": "marec;april",
    "task_type": "setev",
    "section": "this_week",
    "title": "Preveri setev za paprika",
    "short_reason": "Toploljubne plodovke se običajno začnejo v zaščitenem prostoru, ne neposredno na mrzlo gredo.",
    "details": "Uporabi mesečni koledar in sortna navodila; sadike naj imajo dovolj svetlobe.",
    "time_needed": "15–25 min",
    "priority": 6,
    "confidence": "medium",
    "weather_rule_ids": "cold_night;frost_risk",
    "garden_types": "vrt;visoka_greda;balkon",
    "source_ids": "kgzs_plodovke_lonce;ivr_portal"
  },
  {
    "card_id": "paprika_sajenje_7",
    "plant_id": "paprika",
    "months": "maj",
    "task_type": "sajenje",
    "section": "today",
    "title": "Paprika: presajaj šele po varnem toplem obdobju",
    "short_reason": "Plodovke so občutljive na nizke temperature in mrzla tla.",
    "details": "Če so noči hladne, počakaj ali uporabi zaščito. Na balkonih sadike čez noč po potrebi umakni v zavetje.",
    "time_needed": "20–40 min",
    "priority": 8,
    "confidence": "medium",
    "weather_rule_ids": "cold_night;frost_risk;windy_day",
    "garden_types": "vrt;visoka_greda;balkon",
    "source_ids": "kgzs_plodovke_lonce;ivr_portal"
  },
  {
    "card_id": "paprika_zalivanje_8",
    "plant_id": "paprika",
    "months": "junij;julij;avgust",
    "task_type": "zalivanje",
    "section": "today",
    "title": "Zalij paprika ob korenini",
    "short_reason": "Plodovke v vročini hitro trpijo zaradi neenakomerne vlage.",
    "details": "Zalivaj zjutraj ali zvečer. Izogibaj se močenju listov, posebej pri paradižniku in papriki.",
    "time_needed": "10–20 min",
    "priority": 8,
    "confidence": "medium_high",
    "weather_rule_ids": "dry_three_days;hot_day;very_hot_day",
    "garden_types": "vrt;visoka_greda;balkon",
    "source_ids": "kgzs_plodovke_lonce;ivr_portal"
  },
  {
    "card_id": "paprika_pregled_9",
    "plant_id": "paprika",
    "months": "junij;julij;avgust",
    "task_type": "pregled",
    "section": "watch",
    "title": "Preglej liste in zračnost pri paprika",
    "short_reason": "Toplo, vlažno ali mokro vreme poveča tveganje za bolezni pri občutljivih rastlinah.",
    "details": "Odstrani poškodovane liste, izboljšaj zračnost in ne delaj po mokrih rastlinah.",
    "time_needed": "5–10 min",
    "priority": 7,
    "confidence": "medium_high",
    "weather_rule_ids": "humid_warm_day;rain_today",
    "garden_types": "vrt;visoka_greda;rastlinjak",
    "source_ids": "kgzs_plodovke_lonce;ivr_portal"
  },
  {
    "card_id": "paprika_obiranje_10",
    "plant_id": "paprika",
    "months": "julij;avgust;september",
    "task_type": "obiranje",
    "section": "today",
    "title": "Obiraj zrele plodove: paprika",
    "short_reason": "Redno obiranje spodbuja nadaljnjo rast in zmanjšuje preobremenitev rastline.",
    "details": "Obiraj nežno; prezrele ali poškodovane plodove odstrani.",
    "time_needed": "5–15 min",
    "priority": 6,
    "confidence": "medium",
    "weather_rule_ids": "",
    "garden_types": "vrt;visoka_greda;balkon",
    "source_ids": "kgzs_plodovke_lonce;ivr_portal"
  },
  {
    "card_id": "kumare_setev_11",
    "plant_id": "kumare",
    "months": "marec;april",
    "task_type": "setev",
    "section": "this_week",
    "title": "Preveri setev za kumare",
    "short_reason": "Toploljubne plodovke se običajno začnejo v zaščitenem prostoru, ne neposredno na mrzlo gredo.",
    "details": "Uporabi mesečni koledar in sortna navodila; sadike naj imajo dovolj svetlobe.",
    "time_needed": "15–25 min",
    "priority": 6,
    "confidence": "medium",
    "weather_rule_ids": "cold_night;frost_risk",
    "garden_types": "vrt;visoka_greda;balkon",
    "source_ids": "kgzs_plodovke_lonce;ivr_pepelovke_bucevk"
  },
  {
    "card_id": "kumare_sajenje_12",
    "plant_id": "kumare",
    "months": "maj",
    "task_type": "sajenje",
    "section": "today",
    "title": "Kumare: presajaj šele po varnem toplem obdobju",
    "short_reason": "Plodovke so občutljive na nizke temperature in mrzla tla.",
    "details": "Če so noči hladne, počakaj ali uporabi zaščito. Na balkonih sadike čez noč po potrebi umakni v zavetje.",
    "time_needed": "20–40 min",
    "priority": 8,
    "confidence": "medium",
    "weather_rule_ids": "cold_night;frost_risk;windy_day",
    "garden_types": "vrt;visoka_greda;balkon",
    "source_ids": "kgzs_plodovke_lonce;ivr_pepelovke_bucevk"
  },
  {
    "card_id": "kumare_zalivanje_13",
    "plant_id": "kumare",
    "months": "junij;julij;avgust",
    "task_type": "zalivanje",
    "section": "today",
    "title": "Zalij kumare ob korenini",
    "short_reason": "Plodovke v vročini hitro trpijo zaradi neenakomerne vlage.",
    "details": "Zalivaj zjutraj ali zvečer. Izogibaj se močenju listov, posebej pri paradižniku in papriki.",
    "time_needed": "10–20 min",
    "priority": 8,
    "confidence": "medium_high",
    "weather_rule_ids": "dry_three_days;hot_day;very_hot_day",
    "garden_types": "vrt;visoka_greda;balkon",
    "source_ids": "kgzs_plodovke_lonce;ivr_pepelovke_bucevk"
  },
  {
    "card_id": "kumare_pregled_14",
    "plant_id": "kumare",
    "months": "junij;julij;avgust",
    "task_type": "pregled",
    "section": "watch",
    "title": "Preglej liste in zračnost pri kumare",
    "short_reason": "Toplo, vlažno ali mokro vreme poveča tveganje za bolezni pri občutljivih rastlinah.",
    "details": "Odstrani poškodovane liste, izboljšaj zračnost in ne delaj po mokrih rastlinah.",
    "time_needed": "5–10 min",
    "priority": 7,
    "confidence": "medium_high",
    "weather_rule_ids": "humid_warm_day;rain_today",
    "garden_types": "vrt;visoka_greda;rastlinjak",
    "source_ids": "kgzs_plodovke_lonce;ivr_pepelovke_bucevk"
  },
  {
    "card_id": "kumare_obiranje_15",
    "plant_id": "kumare",
    "months": "julij;avgust;september",
    "task_type": "obiranje",
    "section": "today",
    "title": "Obiraj zrele plodove: kumare",
    "short_reason": "Redno obiranje spodbuja nadaljnjo rast in zmanjšuje preobremenitev rastline.",
    "details": "Obiraj nežno; prezrele ali poškodovane plodove odstrani.",
    "time_needed": "5–15 min",
    "priority": 6,
    "confidence": "medium",
    "weather_rule_ids": "",
    "garden_types": "vrt;visoka_greda;balkon",
    "source_ids": "kgzs_plodovke_lonce;ivr_pepelovke_bucevk"
  },
  {
    "card_id": "bucke_setev_16",
    "plant_id": "bucke",
    "months": "marec;april",
    "task_type": "setev",
    "section": "this_week",
    "title": "Preveri setev za bučke",